{
  "schema": "vtl-interoperability-cases",
  "profile_source": "verifiable-telemetry-ledgers",
  "commitment_profile_id": "c08ade4e-1785-4eb6-9648-b7003d76288d",
  "canonical_record_acceptance_cases": [
    {
      "id": "baseline-envelope-4096-octets-depth-16",
      "construction": {
        "record_prefix_hex": "87014800000000000000010100f600",
        "repeated_array_head_hex": "81",
        "repeat_count": 16,
        "innermost_bstr_length": 4062,
        "fill_octet_hex": "00"
      },
      "expected_encoded_length": 4096,
      "payload_nesting_depth": 16,
      "expected_leaf_hash": "a07935d1389d558db64f21186f6d1abc8a873eea0e94d6e7867e404b276c533a",
      "is_conforming_canonical_record": true,
      "inside_baseline_acceptance_envelope": true,
      "permitted_rejection": null
    },
    {
      "id": "conforming-depth-17-outside-baseline-envelope",
      "construction": {
        "record_cbor_hex": "87014800000000000000010100f6008181818181818181818181818181818181f6"
      },
      "expected_encoded_length": 33,
      "payload_nesting_depth": 17,
      "expected_leaf_hash": "106047dff62c279d990aed616090c3aac0f06b11d9f57e1a70836ce242155d27",
      "is_conforming_canonical_record": true,
      "inside_baseline_acceptance_envelope": false,
      "permitted_rejection": "verifier_policy_rejection"
    }
  ],
  "global_sort_traps": [
    {
      "id": "global-sort-before-batch-partition",
      "batch_record_limit": 2,
      "records_cbor_hex_in_admission_order": [
        "87014800000000000000010100f600f6",
        "87014800000000000000020201f600f6",
        "87014800000000000000030302f600f6"
      ],
      "leaf_hashes_in_admission_order": [
        "b83bc27f2d8be3a66373af24e6af3eeffff99ff0696ae18c70e379e853796d26",
        "b5227357cf5d0619914971d8dc5218c5a99260bc5d5e1b60cb1083a911a2acaf",
        "4f82e3e7ee90a111774dd951471a31d4582e0908a0bd5fd63c0080c0231f40cc"
      ],
      "expected_sorted_leaf_hashes": [
        "4f82e3e7ee90a111774dd951471a31d4582e0908a0bd5fd63c0080c0231f40cc",
        "b5227357cf5d0619914971d8dc5218c5a99260bc5d5e1b60cb1083a911a2acaf",
        "b83bc27f2d8be3a66373af24e6af3eeffff99ff0696ae18c70e379e853796d26"
      ],
      "expected_batch_roots": [
        "554491e4edf28061622396b83a870db4652211557127c664c6be1c4ad66471ff",
        "b83bc27f2d8be3a66373af24e6af3eeffff99ff0696ae18c70e379e853796d26"
      ],
      "expected_segment_root": "bc6502552ed0c515f58d1c632e54db37594042609b59838eb0d5b3d5842aa054",
      "forbidden_per_chunk_batch_roots": [
        "0726ecfc16ec6299378b9f3d3675dca2bd9bf701e953134e903d04dab53a1b83",
        "4f82e3e7ee90a111774dd951471a31d4582e0908a0bd5fd63c0080c0231f40cc"
      ],
      "forbidden_per_chunk_segment_root": "4ee0a6cc1f6d192dc52f5630b3eb91b062d15bdec212711749e46b190bc1b8f7",
      "expected_public_recompute_failure_reason": "commitment_mismatch"
    }
  ],
  "aligned_subtree_composition_cases": [
    {
      "id": "five-leaves-three-batches-recursive-split",
      "batch_record_limit": 2,
      "records_cbor_hex": [
        "87014800000000000000010100f600f6",
        "87014800000000000000020201f600f6",
        "87014800000000000000030302f600f6",
        "87014800000000000000040403f600f6",
        "87014800000000000000050504f600f6"
      ],
      "expected_sorted_leaf_hashes": [
        "035aa786b33587812507d2794c359114c378ae7675b3a3832d4ee2502f92e84f",
        "0ecf6c2d4d8ea95d976ef732022530d32ae360be2b656c5f8b41d2b541213c89",
        "4f82e3e7ee90a111774dd951471a31d4582e0908a0bd5fd63c0080c0231f40cc",
        "b5227357cf5d0619914971d8dc5218c5a99260bc5d5e1b60cb1083a911a2acaf",
        "b83bc27f2d8be3a66373af24e6af3eeffff99ff0696ae18c70e379e853796d26"
      ],
      "expected_batch_roots": [
        "a9e4a3f1d6ad5db2e88a968d2b28c2a29c395e93a2ea0881048cefb39d6fbcdb",
        "554491e4edf28061622396b83a870db4652211557127c664c6be1c4ad66471ff",
        "b83bc27f2d8be3a66373af24e6af3eeffff99ff0696ae18c70e379e853796d26"
      ],
      "expected_left_range_root": "5ef061ff3848a866448360eb37262080d4e19e84c9e8cd7972fe6d4194d443ba",
      "expected_segment_root": "1a5d1013548571aeaf1e97b26120e5d5774533b43765e9fd9a68b536ad59ba62"
    }
  ],
  "timestamp_channel_cases": {
    "valid_nonce_case": {
      "id": "appendix-a-digest-valid-nonce-request-response",
      "segment_sha256": "2672cb72d5f06863110af1b30660c7e5ba495c0b2ce7d084b0436e010e99388d",
      "request_der_base64_path": "tsa/appendix-a-nonce.tsq.b64",
      "request_der_sha256": "137f2e52c11fc2a9604354feec0483f4122ec1a0f24507bf99292d7c19305e6c",
      "response_der_base64_path": "tsa/appendix-a-nonce.tsr.b64",
      "response_der_sha256": "6789dc0bc4a7988594a845e00c354660f0d63e79e35b684e836851fbfc36837b",
      "trust_anchor_pem_path": "tsa/test-root.pem",
      "trust_anchor_der_sha256": "a141a1311b6d34343026933b50d46d9ea02cb25dc6534f7cd4dcd54ac3d49254",
      "revocation_crl_pem_path": "tsa/test-root.crl.pem",
      "revocation_crl_der_sha256": "519480d1d96f98d7e75210e3703bef988934d2d7e1c56b44f521739b47e7fb87",
      "tsa_policy_oid": "1.3.6.1.4.1.55555.12",
      "nonce_hex": "2ca5431485fe486d",
      "signer_certificate_der_sha256": "d9605fad90502738f205d5742e93ba9985e6b4e69f09d7f6aa470a4783f894c5",
      "expected_channel_status": "verified"
    },
    "negative_mutations": [
      {
        "id": "granted-with-mods-is-rejected",
        "base_response_der_base64_path": "tsa/appendix-a-nonce.tsr.b64",
        "operation": "set_pki_status_to_granted_with_mods",
        "expected_channel_status": "failed",
        "expected_failure_reason": "channel_failure"
      },
      {
        "id": "multiple-signer-infos-are-rejected",
        "base_response_der_base64_path": "tsa/appendix-a-nonce.tsr.b64",
        "operation": "duplicate_only_cms_signer_info",
        "expected_channel_status": "failed",
        "expected_failure_reason": "channel_failure"
      },
      {
        "id": "legacy-signing-certificate-is-rejected",
        "base_response_der_base64_path": "tsa/appendix-a-nonce.tsr.b64",
        "operation": "replace_signing_certificate_v2_oid_with_legacy_oid",
        "expected_channel_status": "failed",
        "expected_failure_reason": "channel_failure"
      }
    ]
  },
  "lifecycle_cases": [
    {
      "id": "empty-suppress-interval",
      "closure_policy": {
        "interval_ms": 100,
        "batch_record_limit": 2,
        "record_limit": null,
        "size_limit_bytes": null,
        "empty_mode": "suppress"
      },
      "records_before_trigger_lengths": [],
      "trigger": {"kind": "elapsed_boundary", "elapsed_ms": 100},
      "expected": {
        "emitted_segment_count": 0,
        "consumed_segment_numbers": 0,
        "closed_record_count": null,
        "close_reason": null,
        "triggering_record_assignment": "none",
        "successor_opened": true
      }
    },
    {
      "id": "empty-suppress-shutdown",
      "closure_policy": {
        "interval_ms": 100,
        "batch_record_limit": 2,
        "record_limit": null,
        "size_limit_bytes": null,
        "empty_mode": "suppress"
      },
      "records_before_trigger_lengths": [],
      "trigger": {"kind": "shutdown", "elapsed_ms": 50},
      "expected": {
        "emitted_segment_count": 1,
        "consumed_segment_numbers": 1,
        "closed_record_count": 0,
        "close_reason": "shutdown",
        "triggering_record_assignment": "none",
        "successor_opened": false
      }
    },
    {
      "id": "empty-suppress-recovery",
      "closure_policy": {
        "interval_ms": 100,
        "batch_record_limit": 2,
        "record_limit": null,
        "size_limit_bytes": null,
        "empty_mode": "suppress"
      },
      "records_before_trigger_lengths": [],
      "trigger": {"kind": "recovery", "elapsed_ms": 50},
      "expected": {
        "emitted_segment_count": 1,
        "consumed_segment_numbers": 1,
        "closed_record_count": 0,
        "close_reason": "recovery",
        "triggering_record_assignment": "none",
        "successor_opened": true
      }
    },
    {
      "id": "empty-emit-interval",
      "closure_policy": {
        "interval_ms": 100,
        "batch_record_limit": 2,
        "record_limit": null,
        "size_limit_bytes": null,
        "empty_mode": "emit"
      },
      "records_before_trigger_lengths": [],
      "trigger": {"kind": "elapsed_boundary", "elapsed_ms": 100},
      "expected": {
        "emitted_segment_count": 1,
        "consumed_segment_numbers": 1,
        "closed_record_count": 0,
        "close_reason": "interval",
        "triggering_record_assignment": "none",
        "successor_opened": true
      }
    },
    {
      "id": "admission-at-exact-deadline",
      "closure_policy": {
        "interval_ms": 100,
        "batch_record_limit": 2,
        "record_limit": null,
        "size_limit_bytes": null,
        "empty_mode": "suppress"
      },
      "records_before_trigger_lengths": [16],
      "trigger": {"kind": "admission", "elapsed_ms": 100, "record_length": 16},
      "expected": {
        "emitted_segment_count": 1,
        "consumed_segment_numbers": 1,
        "closed_record_count": 1,
        "close_reason": "interval",
        "triggering_record_assignment": "successor_interval",
        "successor_opened": true
      }
    },
    {
      "id": "size-limit-includes-triggering-record",
      "closure_policy": {
        "interval_ms": 100,
        "batch_record_limit": 2,
        "record_limit": null,
        "size_limit_bytes": 20,
        "empty_mode": "suppress"
      },
      "records_before_trigger_lengths": [16],
      "trigger": {"kind": "admission", "elapsed_ms": 50, "record_length": 16},
      "expected": {
        "emitted_segment_count": 1,
        "consumed_segment_numbers": 1,
        "closed_record_count": 2,
        "close_reason": "size_limit",
        "triggering_record_assignment": "closed_interval",
        "successor_opened": true
      }
    },
    {
      "id": "record-limit-includes-triggering-record",